<?xml version="1.0" encoding="UTF-8"?>
<!DOCTYPE KEP_CORKEPERON2002_HDR SYSTEM "simple.dtd" >
<KEP_CORKEPERON2002_HDR>
  <C_TR_CD/>
  <APL_DIS_C0003>APL_DIS_C0003</APL_DIS_C0003>
  <MSG_KD_C0004>MSG_KD_C0004</MSG_KD_C0004>
  <TRN_KD_C0004>TRN_KD_C0004</TRN_KD_C0004>
  <SRM_DIS_C0001>SRM_DIS_C0001</SRM_DIS_C0001>
  <MSG_MNG_NO_C0007>MSG_MNG_NO_C0007</MSG_MNG_NO_C0007>
  <TMS_DY_C0008>TMS_DY_C0008</TMS_DY_C0008>
  <TMS_TM_C0006>TMS_TM_C0006</TMS_TM_C0006>
  <BK_CD_C0002>BK_CD_C0002</BK_CD_C0002>
  <AFCO_NO_C0003>AFCO_NO_C0003</AFCO_NO_C0003>
  <TRN_DIS_CD_C0003>TRN_DIS_CD_C0003</TRN_DIS_CD_C0003>
  <ORGTR_MSG_NO_C0007>ORGTR_MSG_NO_C0007</ORGTR_MSG_NO_C0007>
  <SM_CN_C0001>SM_CN_C0001</SM_CN_C0001>
  <FOUT_MSG_RSP_CD>FOUT_MSG_RSP_CD</FOUT_MSG_RSP_CD>
  <RSP_MSG_TXT/>
  <CTN_PRC_C0021/>
  <SVR_USE_C0004/>
  <SMSGPE_ID_C0010/>
  <RCVER_ID_C0010/>
  <SAF_PRC_YN/>
  <SVR_DIS_C0001/>
  <DPS_AM_SYS_DIS_C0001/>
  <CORT_TRN_DIS_CD>CORT_TRN_DIS_CD</CORT_TRN_DIS_CD>
  <SPAR_C0007/>
  <CORT_CD>CORT_CD</CORT_CD>
  <ACD_YR>ACD_YR</ACD_YR>
  <ACD_SYMB_CD>ACD_SYMB_CD</ACD_SYMB_CD>
  <ACD_SRNO>ACD_SRNO</ACD_SRNO>
  <DEPT_CD_C0002>DEPT_CD_C0002</DEPT_CD_C0002>
  <CORT_JP_NO>CORT_JP_NO</CORT_JP_NO>
  <PRG_YR_C0004>PRG_YR_C0004</PRG_YR_C0004>
  <PRG_SRNO_C0006>PRG_SRNO_C0006</PRG_SRNO_C0006>
  <PI_AM_C0015>PI_AM_C0015</PI_AM_C0015>
  <CORT_RCP_KD_CD>CORT_RCP_KD_CD</CORT_RCP_KD_CD>
  <PI_DY_C0008>PI_DY_C0008</PI_DY_C0008>
  <PAYPE_NM_C0030>PAYPE_NM_C0030</PAYPE_NM_C0030>
  <PAYPE_PSNO>PAYPE_PSNO</PAYPE_PSNO>
  <TEL_NO_C0012>TEL_NO_C0012</TEL_NO_C0012>
  <ZIP_CD_C0007>ZIP_CD_C0007</ZIP_CD_C0007>
  <BAS_AD>BAS_AD</BAS_AD>
  <DTL_AD_C0150/>
  <AGNPE_NM_C0030/>
  <AGNPE_PSNO/>
  <TEL_NO_C0012_1/>
  <ZIP_CD_C0007_1/>
  <BAS_AD_1/>
  <DTL_AD_C0150_1/>
  <BK_CD_C0002_1>BK_CD_C0002_1</BK_CD_C0002_1>
  <BRNO>BRNO</BRNO>
  <CORT_APL_MNG_NO>CORT_APL_MNG_NO</CORT_APL_MNG_NO>
  <RFN_BK_CD>RFN_BK_CD</RFN_BK_CD>
  <RFN_ACT_NO_C0016/>
  <DISP_PSS_NO>DISP_PSS_NO</DISP_PSS_NO>
  <KOR_NM_C0026/>
</KEP_CORKEPERON2002_HDR>
